{
  "schemaVersion": 1,
  "logicalModelId": "qwen2.5-0.5b-instruct",
  "variantId": "gguf-q4-cpu-linux-x86_64",
  "modelPackId": "local-dialogue-basic",
  "runtimeTarget": {
    "os": "linux",
    "architecture": "x86_64",
    "acceleratorClass": "cpu",
    "backendId": "llama-cpp-cpu",
    "runtimeAbi": "nc-gguf-v1",
    "modelFormats": ["gguf"],
    "minimumOsVersion": null,
    "minimumBackendVersion": null,
    "minimumDriverVersion": null,
    "capabilities": {
      "generation": true,
      "embeddings": false,
      "streaming": true,
      "cancellation": true,
      "structuredOutput": false
    }
  },
  "quantization": "q4_k_m",
  "artifactFormat": "gguf",
  "numericalContractId": "nc-gguf-q4-cpu-v1"
}
